{
  "$schema": "https://json-schema.org/draft/2020-12/schema",
  "$id": "https://github.com/itdojp/crypto-communications-assurance/schema/cryptocomm-property-catalog-v1.schema.json",
  "title": "Cryptographic Communication Property Catalog v1",
  "description": "Closed protocol-neutral catalog of security, privacy, recovery, resilience, and evidence-publication outcomes. Entries are not controls, test results, approvals, or product claims.",
  "type": "object",
  "additionalProperties": false,
  "required": [
    "schemaVersion",
    "catalogId",
    "catalogVersion",
    "properties",
    "safety"
  ],
  "properties": {
    "schemaVersion": {
      "const": "cryptocomm-property-catalog/v1"
    },
    "catalogId": {
      "$ref": "#/$defs/catalogId"
    },
    "catalogVersion": {
      "$ref": "#/$defs/semanticVersion"
    },
    "properties": {
      "type": "object",
      "minProperties": 1,
      "maxProperties": 40,
      "propertyNames": {
        "$ref": "#/$defs/propertyId"
      },
      "additionalProperties": {
        "$ref": "#/$defs/propertyEntry"
      }
    },
    "safety": {
      "$ref": "#/$defs/safetyBoundary"
    },
    "fixtureClassification": {
      "description": "Explicit non-authoritative marker used only by committed synthetic fixtures.",
      "const": "synthetic-test-only"
    }
  },
  "$defs": {
    "catalogId": {
      "type": "string",
      "minLength": 3,
      "maxLength": 128,
      "pattern": "^[a-z][a-z0-9]*(?:-[a-z0-9]+)*$"
    },
    "semanticVersion": {
      "type": "string",
      "maxLength": 64,
      "pattern": "^(0|[1-9][0-9]*)\\.(0|[1-9][0-9]*)\\.(0|[1-9][0-9]*)(?:-(?!0[0-9]+(?:\\.|\\+|$))[0-9A-Za-z-]+(?:\\.(?!0[0-9]+(?:\\.|\\+|$))[0-9A-Za-z-]+)*)?(?:\\+[0-9A-Za-z-]+(?:\\.[0-9A-Za-z-]+)*)?$"
    },
    "title": {
      "type": "string",
      "minLength": 1,
      "maxLength": 160
    },
    "definition": {
      "type": "string",
      "minLength": 1,
      "maxLength": 1024
    },
    "boundedStatements": {
      "type": "array",
      "minItems": 1,
      "maxItems": 8,
      "uniqueItems": true,
      "items": {
        "type": "string",
        "minLength": 1,
        "maxLength": 512
      }
    },
    "sourceRefs": {
      "description": "Explanatory primary-source section identifiers. References do not create a compliance or compatibility claim.",
      "type": "array",
      "minItems": 1,
      "maxItems": 8,
      "uniqueItems": true,
      "items": {
        "type": "string",
        "minLength": 8,
        "maxLength": 128,
        "pattern": "^[a-z0-9][a-z0-9.-]{1,63}:section-[A-Za-z0-9.-]{1,64}$"
      }
    },
    "safetyBoundary": {
      "type": "object",
      "additionalProperties": false,
      "required": [
        "executable",
        "networkRequired",
        "secretsAllowed"
      ],
      "properties": {
        "executable": {
          "const": false
        },
        "networkRequired": {
          "const": false
        },
        "secretsAllowed": {
          "const": false
        }
      }
    },
    "propertyId": {
      "type": "string",
      "minLength": 12,
      "maxLength": 128,
      "pattern": "^property\\.([a-z][a-z0-9-]{0,31})\\.([a-z][a-z0-9-]{0,63})$"
    },
    "propertyEntry": {
      "type": "object",
      "additionalProperties": false,
      "required": [
        "id",
        "title",
        "definition",
        "category",
        "assumptions",
        "exclusions",
        "sourceRefs"
      ],
      "properties": {
        "id": {
          "$ref": "#/$defs/propertyId"
        },
        "title": {
          "$ref": "#/$defs/title"
        },
        "definition": {
          "$ref": "#/$defs/definition"
        },
        "category": {
          "enum": [
            "confidentiality",
            "integrity",
            "authentication",
            "binding",
            "replay-ordering",
            "randomness",
            "key-management",
            "downgrade-agility",
            "compromise-recovery",
            "metadata-privacy",
            "resilience",
            "evidence-publication"
          ]
        },
        "assumptions": {
          "$ref": "#/$defs/boundedStatements"
        },
        "exclusions": {
          "$ref": "#/$defs/boundedStatements"
        },
        "dependsOn": {
          "type": "array",
          "maxItems": 8,
          "uniqueItems": true,
          "items": {
            "$ref": "#/$defs/propertyId"
          }
        },
        "requiredEvidenceKinds": {
          "type": "array",
          "minItems": 1,
          "maxItems": 8,
          "uniqueItems": true,
          "items": {
            "enum": [
              "specification",
              "behavioral-test",
              "adversarial-test",
              "formal-model",
              "machine-checked-proof",
              "runtime-control",
              "operational-procedure",
              "human-review"
            ]
          }
        },
        "sourceRefs": {
          "$ref": "#/$defs/sourceRefs"
        }
      }
    }
  }
}
