{
  "schemaVersion": "cryptocomm-property-catalog/v1",
  "catalogId": "cryptocomm-properties",
  "catalogVersion": "0.1.0",
  "properties": {
    "property.confidentiality.message": {
      "id": "property.confidentiality.message",
      "title": "Message confidentiality",
      "definition": "Message content is not disclosed to parties outside the explicitly identified recipient set.",
      "category": "confidentiality",
      "assumptions": [
        "The protected information and intended recipients are explicitly identified for the evaluated context."
      ],
      "exclusions": [
        "This property does not prescribe a protocol, algorithm, key size, storage product, or recipient policy."
      ],
      "requiredEvidenceKinds": [
        "specification",
        "adversarial-test",
        "human-review"
      ],
      "sourceRefs": [
        "rfc3552:section-2.1.1"
      ]
    },
    "property.confidentiality.key-material": {
      "id": "property.confidentiality.key-material",
      "title": "Key-material confidentiality",
      "definition": "Secret keying material and secret key metadata are not disclosed outside their explicitly authorized handling scope.",
      "category": "confidentiality",
      "assumptions": [
        "The protected information and intended recipients are explicitly identified for the evaluated context."
      ],
      "exclusions": [
        "This property does not prescribe a protocol, algorithm, key size, storage product, or recipient policy."
      ],
      "requiredEvidenceKinds": [
        "specification",
        "adversarial-test",
        "human-review"
      ],
      "sourceRefs": [
        "rfc3552:section-2.1.1"
      ]
    },
    "property.integrity.message": {
      "id": "property.integrity.message",
      "title": "Message integrity",
      "definition": "A receiver can detect unauthorized modification, insertion, deletion, or truncation of protected message content.",
      "category": "integrity",
      "assumptions": [
        "The protected object and the state transition in which it is interpreted are explicitly identified."
      ],
      "exclusions": [
        "This property does not establish origin authentication, availability, or correctness of the protected content."
      ],
      "requiredEvidenceKinds": [
        "specification",
        "behavioral-test",
        "adversarial-test"
      ],
      "sourceRefs": [
        "rfc3552:section-2.1.2"
      ]
    },
    "property.integrity.state": {
      "id": "property.integrity.state",
      "title": "State integrity",
      "definition": "Security-relevant communication state changes only through explicitly valid transitions and unauthorized mutation is detectable.",
      "category": "integrity",
      "assumptions": [
        "The protected object and the state transition in which it is interpreted are explicitly identified."
      ],
      "exclusions": [
        "This property does not establish origin authentication, availability, or correctness of the protected content."
      ],
      "requiredEvidenceKinds": [
        "specification",
        "behavioral-test",
        "adversarial-test"
      ],
      "sourceRefs": [
        "rfc3552:section-2.1.2"
      ]
    },
    "property.integrity.configuration": {
      "id": "property.integrity.configuration",
      "title": "Configuration integrity",
      "definition": "Security-relevant configuration is bound to an authorized value set and unauthorized change is detectable before use.",
      "category": "integrity",
      "assumptions": [
        "The protected object and the state transition in which it is interpreted are explicitly identified."
      ],
      "exclusions": [
        "This property does not establish origin authentication, availability, or correctness of the protected content."
      ],
      "requiredEvidenceKinds": [
        "specification",
        "behavioral-test",
        "adversarial-test"
      ],
      "sourceRefs": [
        "rfc3552:section-2.1.2"
      ]
    },
    "property.integrity.transcript": {
      "id": "property.integrity.transcript",
      "title": "Transcript integrity",
      "definition": "The ordered communication transcript used for a security decision is protected against undetected alteration or omission.",
      "category": "integrity",
      "assumptions": [
        "The protected object and the state transition in which it is interpreted are explicitly identified."
      ],
      "exclusions": [
        "This property does not establish origin authentication, availability, or correctness of the protected content."
      ],
      "requiredEvidenceKinds": [
        "specification",
        "behavioral-test",
        "adversarial-test"
      ],
      "sourceRefs": [
        "rfc3552:section-2.1.2"
      ]
    },
    "property.authentication.peer": {
      "id": "property.authentication.peer",
      "title": "Peer authentication",
      "definition": "A party can establish that the communicating peer has the intended scoped identity.",
      "category": "authentication",
      "assumptions": [
        "The asserted identity type, relying party, and authentication direction are explicitly scoped."
      ],
      "exclusions": [
        "This property does not grant authorization, approval, non-repudiation, or trust outside its scoped context."
      ],
      "requiredEvidenceKinds": [
        "specification",
        "adversarial-test",
        "human-review"
      ],
      "sourceRefs": [
        "rfc3552:section-2.1.3"
      ]
    },
    "property.authentication.sender": {
      "id": "property.authentication.sender",
      "title": "Sender authentication",
      "definition": "A receiver can establish the scoped origin identity asserted for a received message.",
      "category": "authentication",
      "assumptions": [
        "The asserted identity type, relying party, and authentication direction are explicitly scoped."
      ],
      "exclusions": [
        "This property does not grant authorization, approval, non-repudiation, or trust outside its scoped context."
      ],
      "dependsOn": [
        "property.integrity.message"
      ],
      "requiredEvidenceKinds": [
        "specification",
        "adversarial-test",
        "human-review"
      ],
      "sourceRefs": [
        "rfc3552:section-2.1.3"
      ]
    },
    "property.authentication.device": {
      "id": "property.authentication.device",
      "title": "Device authentication",
      "definition": "A relying party can establish the scoped device identity participating in a communication.",
      "category": "authentication",
      "assumptions": [
        "The asserted identity type, relying party, and authentication direction are explicitly scoped."
      ],
      "exclusions": [
        "This property does not grant authorization, approval, non-repudiation, or trust outside its scoped context."
      ],
      "requiredEvidenceKinds": [
        "specification",
        "adversarial-test",
        "human-review"
      ],
      "sourceRefs": [
        "rfc3552:section-2.1.3"
      ]
    },
    "property.authentication.service": {
      "id": "property.authentication.service",
      "title": "Service authentication",
      "definition": "A client or peer can establish the scoped service identity intended for the communication.",
      "category": "authentication",
      "assumptions": [
        "The asserted identity type, relying party, and authentication direction are explicitly scoped."
      ],
      "exclusions": [
        "This property does not grant authorization, approval, non-repudiation, or trust outside its scoped context."
      ],
      "requiredEvidenceKinds": [
        "specification",
        "adversarial-test",
        "human-review"
      ],
      "sourceRefs": [
        "rfc3552:section-2.1.3"
      ]
    },
    "property.binding.identity": {
      "id": "property.binding.identity",
      "title": "Identity binding",
      "definition": "The asserted identity is unambiguously bound to the communication context in which it is relied upon.",
      "category": "binding",
      "assumptions": [
        "Every value being bound has an unambiguous representation and lifecycle within the evaluated context."
      ],
      "exclusions": [
        "This property does not define the encoding, protocol transcript, identity system, or session mechanism."
      ],
      "requiredEvidenceKinds": [
        "specification",
        "behavioral-test",
        "formal-model"
      ],
      "sourceRefs": [
        "rfc9180:section-9.6",
        "rfc9420:section-14"
      ]
    },
    "property.binding.role": {
      "id": "property.binding.role",
      "title": "Role binding",
      "definition": "An asserted role is unambiguously bound to the authenticated identity and scoped communication context.",
      "category": "binding",
      "assumptions": [
        "Every value being bound has an unambiguous representation and lifecycle within the evaluated context."
      ],
      "exclusions": [
        "This property does not define the encoding, protocol transcript, identity system, or session mechanism."
      ],
      "dependsOn": [
        "property.binding.identity"
      ],
      "requiredEvidenceKinds": [
        "specification",
        "behavioral-test",
        "formal-model"
      ],
      "sourceRefs": [
        "rfc9180:section-9.6",
        "rfc9420:section-14"
      ]
    },
    "property.binding.session": {
      "id": "property.binding.session",
      "title": "Session binding",
      "definition": "Messages and security decisions are unambiguously bound to the intended session instance.",
      "category": "binding",
      "assumptions": [
        "Every value being bound has an unambiguous representation and lifecycle within the evaluated context."
      ],
      "exclusions": [
        "This property does not define the encoding, protocol transcript, identity system, or session mechanism."
      ],